{
  "schema": "TEV_SCRIPT_CONFORMANCE_SCENARIO_V1",
  "scenario_id": "distributed.lockstep.v1",
  "program": "../examples/Player.tevs.ir.json",
  "entity_id": "Player",
  "capabilities": {
    "debug.log": {
      "mode": "trace"
    },
    "input.move2d": {
      "mode": "constant",
      "value_type": "Vec2",
      "value": [
        {
          "$rat": [
            "1",
            "1"
          ]
        },
        {
          "$rat": [
            "0",
            "1"
          ]
        }
      ]
    },
    "motion.move2d": {
      "mode": "trace"
    },
    "animation.play": {
      "mode": "trace"
    }
  },
  "invocations": [
    {
      "entity_id": "Player",
      "event_id": "start",
      "arguments": []
    },
    {
      "entity_id": "Player",
      "event_id": "update",
      "arguments": []
    },
    {
      "entity_id": "Player",
      "event_id": "damage",
      "arguments": [
        {
          "type": "Int",
          "value": {
            "$int": "7"
          }
        }
      ]
    },
    {
      "entity_id": "Player",
      "event_id": "update",
      "arguments": []
    },
    {
      "entity_id": "Player",
      "event_id": "damage",
      "arguments": [
        {
          "type": "Int",
          "value": {
            "$int": "13"
          }
        }
      ]
    },
    {
      "entity_id": "Player",
      "event_id": "update",
      "arguments": []
    },
    {
      "entity_id": "Player",
      "event_id": "damage",
      "arguments": [
        {
          "type": "Int",
          "value": {
            "$int": "31"
          }
        }
      ]
    },
    {
      "entity_id": "Player",
      "event_id": "damage",
      "arguments": [
        {
          "type": "Int",
          "value": {
            "$int": "49"
          }
        }
      ]
    },
    {
      "entity_id": "Player",
      "event_id": "damage",
      "arguments": [
        {
          "type": "Int",
          "value": {
            "$int": "1"
          }
        }
      ]
    },
    {
      "entity_id": "Player",
      "event_id": "update",
      "arguments": []
    }
  ]
}
